Category,Headline,SubHeading
Vuelta a España,Evenepoel fik stjerne til at lide: - Jeg havde det forfærdeligt,"Romain Bardet havde en hård dag i udbruddet på 14. etape, selvom det nærmest kun var Remco Evenepoel, der tog føringer"
Vuelta a España,Stolt Evenepoel reagerer på sejren,Remco Evenepoel tog sin anden etapesejr på 14. etape af Vueltaen
Vuelta a España,Cykelskifte har givet Vingegaard ondt i ryggen,Danskeren kom i mål sammen med resten af favoritterne
Vuelta a España,Evenepoel fuldender stort togt dagen efter kollaps,Jumbo-Vismas Sepp Kuss holder fast i førertrøjen
Vuelta a España,"- I går var en svær aften. Der var mange tårer, fortæller Evenepoel",Sidste års vinder af Vuelta a España tabte næsten en halv time på fredagens etape
