Category,Headline,SubHeading
Amerikansk fodbold,Stjerne hylder Andersen: - Han rykkede grænserne for spillet,Morten Andersen har gjort stort indtryk på Baltimore Ravens' stjerne-kicker Justin Tucker
Amerikansk fodbold,Stor forvirring omkring udvisning: - Dommerne anede intet,"Et dommer-team i USA måtte træffe beslutningen i kampen, der blev afviklet i London. "
Amerikansk fodbold,Stjerne smidt ud efter grim tackling,Receiveren Chris Moore fik en tackling direkte mod hovedet og var groggy efter slaget
Amerikansk fodbold,Froholdt møder unikum: - Han kan overtage en kamp fuldstændig,"Der venter Hjalte Froholdt en kæmpe opgave, når han søndag står over for selveste Aaron Donald. "
Amerikansk fodbold,Historiens største NFL-hold i dyb krise: - Det er opsigtsvækkende,"Hvis projekt Patriots skal lykkes, kræver det, at holdet starter forfra, mener ekspert"
Amerikansk fodbold,"- Det var den mest ydmygende kamp, jeg nogensinde har været en del af","Dallas Cowboys og Dak Prescott kæmpede med tingene mod San Francisco 49ers natten til mandag dansk tid, hvor de tabte med 32 point"
Amerikansk fodbold,Quarterback raser: - Det hører ingen steder hjemme,"Geno Smith kan dog glæde sig over, at han kom tilbage i kampen, som hans hold vandt sikkert"
Amerikansk fodbold,Froholdt eskorteret fra banen: - Jeg forstod det ikke,Den danske NFL-spiller måtte ikke gå tilbage på banen
Amerikansk fodbold,Enorm tumult efter hård tackling,"Justin Herbert blev tacklet uden for banen af en tidligere holdkammerat, og det fik sindene i kog"
Amerikansk fodbold,"Det er jo vanvittigt, siger ekspert om touchdown",Diggs’ touchdown på 55 yards er Bills’ længste offensive spil i hele sæsonen
Amerikansk fodbold,Mahomes bliver hurtigste quarterback med 200 touchdowns,Hurtigere end nogen anden quarterback i NFL-historien kastede Patrick Mahomes sit touchdown nummer 200
Amerikansk fodbold,Lå livløs på banen for 272 dage siden – søndag var han tilbage i kamp,Damar Hamlin var søndag iført skulderbeskytter og hjelm i en NFL-kamp for første gang siden hjertestoppet
Amerikansk fodbold,Ekspert glæder sig til NFL-brag: - Det bliver meget dramatisk og vildt,"De to hold med flest scorede point mødes søndag aften, og der er lagt op til spænding til det sidste"
Amerikansk fodbold,Blev verdenskendt for sit knæ – jobansøgning viser hans længsel efter comeback,Colin Kaepernicks jobansøgning er kommet til offentligt skue
Amerikansk fodbold,Dansker får ros efter sin bedste kamp,"Hjalte Froholdt og Cardinals stod overfor ligaens måske sværeste defensive linje, da de overraskende slog Cowboys 28-16"
Amerikansk fodbold,Stjerne vender tilbage og hjælper Bengals til sejr,Cincinatti Bengals slog natten til tirsdag Los Angeles Rams 19-16 med tilbagevendende Joe Burrow i offensiven
Amerikansk fodbold,Kontroversiel beslutning var millimeter fra at koste sejren,"Los Angeles Chargers blev reddet, efter de begik en gruelig fejl, mener TV 2 Sports kommentatorer"
Amerikansk fodbold,"Froholdt skal stoppe superstjerne: - Hvis du havner mod ham, så step up","Danmarks eneste NFL-spiller prøver at forblive i nuet, mens han forbereder sig på weekendens storkamp. "
Amerikansk fodbold,49ers buldrer videre,Anført af quarterbacken Brock Purdy vandt San Francisco 49ers over New York Giants i NFL
Amerikansk fodbold,Stjerne udgår med skrækskade,Nick Chubb er en af NFL's bedste runningbacks. 
Amerikansk fodbold,Kommentatorer måber: - Det er spektakulært,New Orleans Saints-spilleren Chris Olave havde en afgørende hånd med i sejren på 20-17 over Carolina Panthers
Amerikansk fodbold,Misbruger gylden mulighed efter mirakuløst spil,"Denver havde held med en Hail Mary i de døende sekunder af kampen mod Washington, men formåede ikke at tvinge kampen i overtid"
Amerikansk fodbold,"- Jeg er fuldstændig knust, siger NFL-stjerne","Aaron Rodgers fortæller, at han vil komme stærkt igen"
Amerikansk fodbold,Superstjerne er ude resten af sæsonen,Jets’ fans nåede at drømme om store ting med Aaron Rodgers ved roret. Nu lider de drømme et stort knæk
Amerikansk fodbold,Stjerne får mareridtsdebut – skadet efter få minutter,"De forventningsfulde fans fik ikke meget at se til superstjernen Aaron Rodgers, der fik en skade i akillessenen.
"
Amerikansk fodbold,Ravens-profil ude resten af sæsonen,Baltimore Ravens må undvære et stærkt kort på running back-pladsen
Amerikansk fodbold,Tidlig kandidat til årets mærkeligste spil: - Det var helt vildt,"Man skal huske at spille, indtil dommerens fløjte lyder. "
Amerikansk fodbold,Froholdt er klar til karrierens største NFL-sæson,"Aldrig har så mange øjne været rettet mod Hjalte Froholdt, når han tager hul på den nye NFL-sæson som potentiel starter for Arizona Cardinals"
Amerikansk fodbold,NFL godkender rekordsalg af Washington Commanders,"Washington Commanders er blevet solgt for 6,05 milliarder dollar til et konsortium med Josh Harris i spidsen"
Amerikansk fodbold,NFL-legende og skuespiller Jim Brown er død,"I en alder af 87 år er en af historiens største NFL-stjerner gået bort. Det fortæller hans hustru.
"
Amerikansk fodbold,"- Han er for vild, siger ekspert om NFL-draftens førstevalg","TV 2 SPORTs NFL-ekspert er helt vild med Bryce Young, der natten til fredag blev draftet til Carolina Panthers som den første i årets NFL-draft"
Amerikansk fodbold,Ravens gør quarterback til NFL-historiens bedst betalte,"Lamar Jacksons nye femårige kontrakt med Baltimore Ravens gør ham angiveligt til ligaens højest lønnede.
"
Amerikansk fodbold,"- Rodgers kæmper lige nu for sit eftermæle, siger ekspert","Med skiftet til New York Jets kæmper Aaron Rodgers for sit eftermæle, mener TV 2-eksperten Jesper Elming"
Amerikansk fodbold,Superstjerne skifter klub i stor handel,Aaron Rodgers vinker farvel til Green Bay Packers efter 18 år i et stort skifte. 
Amerikansk fodbold,NFL-spiller får grønt lys til comeback efter hjertestop,"Damar Hamlin er tilbage i træning, og der er intet til hinder for, at han kan genoptage NFL-karrieren"
Amerikansk fodbold,NFL-stjerne vil væk fra Ravens,Forhandlingerne mellem Lamar Jackson og Baltimore Ravens er gået i hårknude
Amerikansk fodbold,Lykkelig Froholdt: - Situationen virker for perfekt,Hjalte Froholdt flyttede efter sæsonen til Phoenix for at træne frem mod næste NFL-sæson
Amerikansk fodbold,Ekspert fremhæver særligt én ting i danskers kontrakt,"Danske Hjalte Froholdt har sat sin underskrift på en toårig kontrakt med Arizona Cardinals, og det glæder TV 2 SPORTs NFL-ekspert Jesper Elming"
Amerikansk fodbold,Froholdt skriver under med nyt NFL-hold,Onsdag aften har danske Hjalte Froholdt sikret sig en kontrakt for de næste to år med Cardinals
Amerikansk fodbold,Kan du huske det? Her er de bedste billeder fra en vild NFL-sæson,"NFL-sæsonen 2022/2023 bød på mange højdepunkter. TV 2 SPORT har her samlet et udpluk af det, vi vil huske den begivenhedsrige sæson for"
Amerikansk fodbold,Afgjorde Super Bowl med både Adidas og Nike på fødderne,Kansas City Chiefs vandt Super Bowl efter et tæt opgør mod Philadelphia Eagles. Kampen fandt sin afgørelse i de døende sekunder
Amerikansk fodbold,Lægger sig fladt ned efter afgørende straf i Super Bowl,"Dommernes kald sendte mange fans i det røde felt. Eagles-skurken erkender dog, at den var fair"
Amerikansk fodbold,"- Han er udødeliggjort, siger dansk legende","Natten til mandag tørnede Philadelphia Eagles og Kansas City Chiefs sammen i Super Bowl 57 i en højtscorende affære, hvor Chiefs trak længste strå"
Amerikansk fodbold,Stjerne ramt efter triumf: - Jeg løj for alle,"På sociale medier blev begivenheden omdøbt til ""Kelce Bowl"" på grund af brødreduellen, som var samtaleemne"
Amerikansk fodbold,"- Jeg er stolt. Det er ikke sunket ind endnu, siger Mahomes","Patrick Mahomes tog sin anden Super Bowl-triumf i karrieren, og han var hurtig til at takke alle andre end sig selv"
Amerikansk fodbold,Chiefs vinder Super Bowl efter dramatisk kamp,Kansas City Chiefs vinder i kampens sidste sekunder dette års Super Bowl-titel over Philadelphia Eagles 38-35 i NFL-finalen natten til mandag
Amerikansk fodbold,Et enigt ekspertpanel udpeger Super Bowl-favorit,"TV 2 SPORTs NFL-eksperter peger alle på Philadelphia Eagles som vinder, når der i nat spilles årets udgave af Super Bowl"
Amerikansk fodbold,Kelce-brødre kæmper om håneretten i Super Bowl,"Travis og Jason Kelce er brødre og skal møde hinanden i Super Bowl. Én sikrer triumfen, mens den anden går hjem som taber"
Amerikansk fodbold,Fra hæmsko til redningsmænd,TV 2 SPORTs NFL-ekspert Jesper Elming sætter i denne uges klumme fokus på en af Super Bowl-deltagerne Kansas City Chiefs helt store styrker
Amerikansk fodbold,Morten Andersen blev kørt midtover af Super Bowl-futtoget,"Morten Andersen er den eneste dansker, der har deltaget i en Super Bowl. Det gjorde han for 24 år siden, og han husker det stadig tydeligt"
Amerikansk fodbold,"Ti ting, du måske ikke vidste om årets Super Bowl","Vi klæder dig på til årets Super Bowl med ti fakta om NFL-finalen, der spilles i byen Glendale i Arizona"
Amerikansk fodbold,Landsholdets quarterback sætter NFL-stjerner under lup,Den danske landsholds-quarterback vurderer søndagens Super Bowl-møde på quarterback-positionen. Og der er sat vand over til en eksplosiv duel
Amerikansk fodbold,Hver uge trænede dansker med en af NFL’s største stjerner,"Superligalegenden Jimmy Nielsen har spist kirsebær med Patrick Mahomes, tidens største NFL-stjerne, da de begge boede i Kansas City"
Amerikansk fodbold,"- Helt vildt, at I er fløjet hele vejen fra Danmark, siger NFL-stjerne",Haason Reddick og Jason Kelce sætter pris på interessen for NFL globalt
Amerikansk fodbold,Stjerne får perfekt optakt til Super Bowl,Patrick Mahomes er blevet kåret som sæsonens mest værdifulde spiller efter en overlegen sejr
Amerikansk fodbold,"Årets Super Bowl går over i historien, allerede før den er gået i gang","Kun syv andre sorte quarterbacks har spillet i Super Bowl, siden den første gang løb af stablen i 1967"
Amerikansk fodbold,Brady udskyder start på milliard-kontrakt,"Den tidligere New England Patriots-spiller har annonceret, at han vil tage et friår"
Amerikansk fodbold,"Tak for alle minderne, Tom!","NFL-ekspert Jesper Elming hylder Tom Brady, der indstiller sin lange og glorværdige karriere"
Amerikansk fodbold,NFL-dansker fik gode råd af Brady over frokosten,"Hjalte Froholdt tilbragte sit første år af karrieren sammen med NFL-legenden Tom Brady, som nu er stoppet"
Amerikansk fodbold,Brady stopper karrieren – igen,"Tom Brady har igen annonceret sit karrierestop, og denne gang skulle det være gældende. Han anses for at være den største i sporten"
Amerikansk fodbold,Kansas City Chiefs booker den sidste plads i Super Bowl,Kansas City Chiefs er klar til Super Bowl mod Philadelphia Eagles efter AFC-sejren over Cincinnati Bengals
Amerikansk fodbold,Philadelphia Eagles sikrer den ene Super Bowl-plads,Med en suveræn sejr over San Francisco 49'ers er Philadelphia Eagles klar til Super Bowl
Amerikansk fodbold,Min første football-forelskelse,NFL-ekspert Jesper Elming skriver denne gang om sin første forelskelse - den venstrehåndede quarterback Boomer Esiason
Amerikansk fodbold,Hamlin deler takkevideo efter sit hjertestop,"Damar Hamlin takker i en video både sin familie, fans, sundhedspersonale og hele NFL"
Amerikansk fodbold,Cowboys-profil har brækket benet,Runningbacken Tony Pollard skal opereres efter den uheldige episode i nattens slutspilskamp
Amerikansk fodbold,- Det må få et efterspil,Der var drama på sidelinjen og i omklædningsrummet efter Buffalo Bills' skuffende exit søndag
Amerikansk fodbold,49ers sparker sig videre i slutspillet,Kickeren Robbie Gould sparkede San Francisco 49ers frem til semifinalerne i NFL med sejr over Dallas Cowboys
Amerikansk fodbold,Bengals sender overraskende Bills ud,"For andet år i træk skal Cincinnati spille AFC-finale med Kansas City. Vinder de, skal de spille Super Bowl"
Amerikansk fodbold,- De er min store favorit til at vinde Super Bowl,"Der er otte hold tilbage i denne NFL-sæson, og et af dem står ud som det stærkeste, hvis man spørger TV 2 SPORTs NFL-ekspert Jesper Elming"
Amerikansk fodbold,"Hvad nu, Brady? Her er superstjernens muligheder","Vælger Tom Brady at fortsætte sin karriere, er han stadig yderst attraktiv, mener TV 2 SPORTs NFL-ekspert Jesper Elming"
Amerikansk fodbold,"En god, gammeldags ”ryste-sammen-lejr” blev altafgørende","En god, gammeldags ”ryste-sammen-lejr” var altafgørende. Kemien med quarterbacken er altafgørende. Mahomes’ egen træningslejr har båret frugt"
Amerikansk fodbold,Morten Andersen røg til tasterne efter historiske afbrændere,"Morten Andersen jokede med at genoptage sin NFL-karriere, da han så playoffkampen mellem Cowboys og Buccaneers"
Amerikansk fodbold,Bradys sæson slutter med ydmygelse i NFL's slutspil,"Publikum i Tampa var tydeligt utilfredse med Tom Brady og resten af Tampa Bay Buccaneers, der tabte stort til Dallas Cowboys"
Amerikansk fodbold,Historisk spil sikrer Bengals avancement,Et fumble return på hele 98 yards sikrede Cincinnati Bengals sejren over Baltimore Ravens i NFL-slutspillet
Amerikansk fodbold,Et spark for 32 år siden bliver aldrig glemt,"Når Buffalo Bills skal forsøge at leve op til favoritværdigheden i NFL-slutspillet, er det især mindet om Super Bowl XXV, de vil udviske"
Amerikansk fodbold,Vanvittigt comeback sikrer kæmpe sejr i slutspillet,"Jacksonville Jaguars lavede det tredjestørste comeback i historien, da de spillede sig videre i slutspillet i NFL"
Amerikansk fodbold,Favoritter og analyse: Få det store overblik over NFL-slutspillet her,Her gennemgår TV 2 SPORTs NFL-ekspert Jesper Elming kampene i sæsonens første slutspilsweekend
Amerikansk fodbold,"Er du klar til NFL's ""supervilde weekend""?",NFL-ekspert Jesper Elming kigger nærmere på den sidste måned af sæsonen
Amerikansk fodbold,NFL-dansker søger kontrakt: - Jeg håber at kunne vælge selv,"Hjalte Froholdt ser tilbage på en stor NFL-sæson, hvor det er blevet til adskillige minutter på banen"
Amerikansk fodbold,NFL-spillers indsamling eksploderede — dét skal pengene gå til,"Det er ikke længere kun børn, der får glæde af Damar Hamlins indsamling"
Amerikansk fodbold,Kollapset NFL-spiller udskrevet fra hospitalet,Damar Hamlin har forladt hospitalet i Buffalo. NFL-spilleren fik hjertestop i begyndelsen af januar
Amerikansk fodbold,Godt nyt om kollapset NFL-spiller,Hamlin er ikke længere indlagt på intensivafdelingen på et hospital i Cincinnati. I stedet skal han overvåges af et nyt hold læger i hjembyen Buffalo
Amerikansk fodbold,Udskældt NFL-spiller siger nu undskyld,Førsteårsspilleren Quay Walker skubbede til et medlem af Detroit Lions' sundhedsstab og blev efterfølgende bortvist
Amerikansk fodbold,Her taber spiller hovedet med uhørt handling,For første gang i 23 år modtog en spiller to bortvisninger i samme sæson. Den ikke så eftertragtede bedrift står førsteårsspilleren Quay Walker bag
Amerikansk fodbold,Storhold snubler på målstregen – få overblikket over NFL’s slutspil her,"Green Bay Packers skulle bruge en hjemmesejr over divisionsrivalen Detroit Lions, der havde udspillet sin rolle. Det fik de ikke"
Amerikansk fodbold,- Jeg har aldrig set noget lignende,"Kansas City Chiefs så ud til at have det rigtig sjovt i kampen mod Las Vegas Raiders, hvor ét spil skilte sig gevaldigt ud"
Amerikansk fodbold,Titans smider slutspilsplads væk i dramatisk afslutning,Med under tre minutter tilbage mistede Tennessee Titans føringen efter en fumble af quarterback Joshua Dobbs. Det viste sig at blive afgørende
Amerikansk fodbold,NFL-spiller sender første hilsen efter hjertestop,"I sit første opslag på sociale medier efter kollaps takker Hamlin alle og siger, at der er en lang vej forude"
Amerikansk fodbold,"- Hvis ikke de vinder, vil det være en kæmpe skuffelse",De sidste pladser i slutspillet og de altafgørende seedninger er på spil i den sidste række af kampe i grundspillet i NFL
Amerikansk fodbold,Mulig neutral bane i AFC-finale efter kollaps,Plat eller krone samt en neutral bane kan muligvis komme i spil efter aflyst NFL-kamp
Amerikansk fodbold,NFL-spiller trækker selv vejret efter hjertestop,"Damar Hamlin blev genoplivet med livreddende førstehjælp, efter at han faldt om på banen med hjertestop"
Amerikansk fodbold,Kollapset spillers første ord: - Hvem vandt?,"Læger på University of Cincinnati Medical Center, hvor Hamlin er indlagt, har på et pressemøde afsløret detaljer omkring spillerens helbred"
Amerikansk fodbold,NFL aflyser kamp tre dage efter kollaps,"Mens der meldes om markant bedring hos Damar Hamlin, er kampen mellem Super Bowl-bejlere blevet aflyst"
Amerikansk fodbold,Familien til kollapset spiller frikender stjerne for skyld,"Hadbeskeder til og kritik af Tee Higgins hører ingen steder hjemme, mener kollegaer og Damar Hamlins familie"
Amerikansk fodbold,"""Bemærkelsesværdig fremgang"" for kollapset NFL-spiller","Damar Hamlin er stadig ""kritisk syg"", men hans hold melder om godt nyt det seneste døgn"
Amerikansk fodbold,Søger afklaring efter aflyst kamp: - Det er ude af vores hænder,"Uanset hvad NFL vælger at gøre, accepterer Baltimore Ravens beslutningen. De appellerer dog til snarlig handling"
Amerikansk fodbold,Damar Hamlin var i gang med at leve den amerikanske drøm,"NFL-ekspert Jesper Elming skriver i denne omgang om Buffalo Bills-spilleren Damar Hamlin, der kollapsede med et hjertestop tirsdag"
Amerikansk fodbold,Tegn på bedring for NFL-spiller efter kollaps,Buffalo Bills har givet en ny opdatering på Damar Hamlin. Samtidig har spillerens familie takket for støtten
Amerikansk fodbold,Spillers indsamling til legetøj går amok efter kollaps,Donationerne vælter ind til Damar Hamlins indsamling til køb af legetøj til børn efter spillerens kollaps
Amerikansk fodbold,NFL-spiller kollapsede med hjertestop midt på banen,Damar Hamlin kollapsede kort efter en hård tackling og blev genoplivet på banen. Han er fortsat i kritisk tilstand
Amerikansk fodbold,NFL-verdenen beder for kollapset spiller,"NFL-spilleren Damar Hamlin er i kritisk tilstand, efter han kollapsede midt på banen efter en tackling"
Amerikansk fodbold,"Brady må slikke sig om munden, men Panthers har es i ærmet","NFL-ekspert Jesper Elming skriver i denne omgang om Carolina Panthers, der stik imod alle odds kan komme med i slutspillet"
Amerikansk fodbold,Fra barista til NFL: 35-årig veteran i opsigtsvækkende comeback,En gammel kending skal hjælpe Carolina Panthers i søndagens nøglekamp mod Tampa Bay Buccaneers
Amerikansk fodbold,NFL-hold skrotter stjerne og opgiver reelt slutspilshåb,"Las Vegas Raiders lader til at hejse det hvide flag for sæsonen, efter at holdet har bænket quarterback Derek Carr i grundspillets sidste to kampe"
Amerikansk fodbold,NFL-stjerne stopper karrieren,"J.J. Watt har aldrig vundet Super Bowl, men har høstet meget personlig hæder i karrieren, der snart slutter"
Amerikansk fodbold,NFL-hold fyrer træner efter katastrofal sæson,"Nathaniel Hackett skulle forløse Denver Broncos, men endte med at blive fyret efter kun 15 kampe"
Amerikansk fodbold,Tidligere Super Bowl-vinder undskylder for at banke mand med flaske,McGinest er blandt de bedste spillere i New England Patriots' historie. Linebacken spillede 11 år i klubben og vandt Super Bowl tre gange
Amerikansk fodbold,"Det var den vildeste afslutning, jeg nogensinde har set","NFL-ekspert Jesper Elming skriver i denne omgang om den vilde spillerunde i NFL. Kampene var vanvittigt tætte, og vi fik det største comeback"
Amerikansk fodbold,Lækker NFL-menu juleaften: Få overblikket her,"Julen bliver ekstra delikat for NFL-elskere, der kan se frem til action både juleaften og juledag"
Amerikansk fodbold,Brady i gang med historisk dårlig sæson: - Det er hårdt,"Selvom Tom Brady og Buccaneers har tabt flere kampe, end de har vundet, er de stadig i en god position til at komme i slutspillet"
Amerikansk fodbold,Super Bowl-vinder tangerer kedelig rekord,Med tre spillerunder igen kan den forsvarende Super Bowl-mester Los Angeles Rams ikke længere nå slutspillet
Amerikansk fodbold,"Hele stadion var i chok, da stjerne forærede kampen væk","New England Patriots smed sejren væk, selvom tiden var løbet ud. Wide receiveren Jakobi Meyers stod bag den skæbnesvangre beslutning"
Amerikansk fodbold,Leverer det største comeback i historien,"Minnesota Vikings leverede det største comeback i NFL's historie, da de indhentede Indianapolis Colts' forspring på 33 point"
Amerikansk fodbold,Hans fortælling er et filmmanuskript værdigt,NFL-ekspert Jesper Elming skriver denne gang om Baker Mayfield og Jared Goffs historier og udvikling
Amerikansk fodbold,"22-årig bliver kaldt irrelevant – da han smadrede Bradys hold, brød hans far sammen",Unge Brock Purdy fortsætter sin utrolige historie for San Francisco 49ers. Søndag gik det ud over legenden Tom Brady og Tampa Bay Buccaneers
Amerikansk fodbold,Første hold er klar til NFL-slutspillet,"En overlegen sejr over New York Giants betyder, at Philadelphia Eagles officielt er klar til NFL-slutspillet"
Amerikansk fodbold,- Du er irrelevant,"NFL-ekspert Jesper Elming skriver denne gang om ""Hr. Irrelevant"", der blev valgt sidst i draften"
Amerikansk fodbold,Nyankommet spiller fører NFL-hold til stort comeback,Baker Mayfield skiftede tirsdag til Los Angeles Rams. Torsdag førte han NFL-holdet til en comebacksejr
Amerikansk fodbold,Vildt comeback sikrer Brady endnu en NFL-rekord,"Tampa Bay Buccaneers var bagud med 13 point kort før tid, men vandt alligevel med Tom Brady som dirigent"
Amerikansk fodbold,Dansker får startplads i suspenderet stjernes comeback,"Deshaun Watson fik comeback efter 11 kampes karantæne, da Cleveland Browns og Hjalte Froholdt vandt"
Amerikansk fodbold,En ode til de store drenge,NFL-ekspert Jesper Elming skriver denne gang om ligaens store og tunge drenge på den offensive linje
Amerikansk fodbold,Madden ville have elsket Derrick Henry,"NFL-ekspert Jesper Elming skriver denne gang om ligaens farligste running back, som forsvarsspillere frygter på ethvert spil"
Amerikansk fodbold,- Jeg er ked af at være emotionel. Jeg er bare rasende,"Las Vegas Raiders' quarterback brød sammen på pressemødet efter kampen, hvor de endnu en gang gik fra banen med et nederlag"
Amerikansk fodbold,Chokbølger igennem NFL,NFL-ekspert Jesper Elming zoomer ind på Indianapolis Colts
Amerikansk fodbold,Legende rammer svimlende milepæl,I en sejr over NFL-mestrene fra Los Angeles Rams nåede Tom Brady op på 100.000 passing yards i karrieren
Amerikansk fodbold,Handel med draft picks er det nye sort,NFL-ekspert Jesper Elming har ser nærmere på den sidste dag i NFL's transfervindue
Amerikansk fodbold,Den dybe krise er tydelig for enhver,"NFL-ekspert Jesper Elming ser nærmere på Green Bay Packers, der inden sæsonen var hans favorit til at nå Super Bowl"
Amerikansk fodbold,"- Det er surrealistisk, siger NFL-dansker efter historisk præstation","Hjalte Froholdt fortæller, at det var nervepirrende at skulle spille fra start i verdens bedste liga"
Amerikansk fodbold,NFL-danskers aktion fik ekspert til at smågrine,Danske Hjalte Froholdt skrev historie søndag nat
Amerikansk fodbold,NFL-dansker taber tæt kamp i starter-debut,"Danske Hjalte Froholdt måtte gå fra banen med et nederlag, da han søndag startede inde for første gang i NFL"
Amerikansk fodbold,Store bogstaver blandt store mænd,TV 2 SPORTs NFL-ekspert Jesper Elming sætter i denne uges klumme fokus på balladen i NFLs ejerkreds
Amerikansk fodbold,"Ekspert om danskers bedrift: - Det er ikke gået op for mange, hvor stort det er","Søndag aften skriver Hjalte Froholdt historie. Han er nemlig den første dansker, der nogensinde er med fra start i en NFL-kamp"
Amerikansk fodbold,Dansker klar til første NFL-start,Hjalte Froholdt får sin første NFL-start på søndag
Amerikansk fodbold,Færdig på NFL-hold efter kontrovers,"Robbie Anderson ragede sig uklar med sine chefer under en kamp, og nu er han fortid på holdet"
Amerikansk fodbold,NFL-spiller smidt ud af egen træner,"Robbie Anderson fortæller, at han ikke aner, hvad der skete, og hvorfor han blev sendt væk"
Amerikansk fodbold,"Fire europæiske NFL-hold? Nej, stop nu",TV 2 SPORTs NFL-ekspert Jesper Elming sætter i denne uges klumme fokus på snakken om mulige europæiske NFL-hold
Amerikansk fodbold,NFL-dansker glæder sig over anderledes rolle,På søndag møder Hjalte Froholdt sit tidligere hold New England Patriots
Amerikansk fodbold,Brady får bøde for at sparke ud efter modstander,"Det er ikke første gang, at Tom Brady har sådanne tilbøjeligheder"
Amerikansk fodbold,Kendelser forarger og bekymrer eksperter,"Det er tæt på umuligt at spille forsvar, hvis reglerne håndhæves, som de blev det i to af femte spillerundes kampe, mener Jesper Elming"
Amerikansk fodbold,Stjerne undskylder sit raseriudbrud,"Det er endnu uvist, om episoden får konsekvenser for Davante Adams"
Amerikansk fodbold,NFL-spillers far kaldt på banen – forlod stadion med sin kollapsede søn,"Heldigvis er der godt nyt fra Saivion Smith, der på Twitter bekræfter, at han snart er tilbage"
Amerikansk fodbold,Et grimt syn. NFL er nødt til at gøre noget nu,"NFL kan sætte sin enorme opbakning over styr, hvis man ikke gør mere, når der opstår hovedskader"
Amerikansk fodbold,- Sikkerhedsfolkene så ud til at være i problemer,"Bobby Wagner fulgte sit instinkt, da han tacklede en baneløber i kampen mellem Los Angeles Rams og San Francisco 49ers"
Amerikansk fodbold,"NFL-stjerne lurer i kulissen, men hans ry kan blive et problem","Han er kendt som en stjernereceiver og en – af og til – endnu større primadonna, og om lidt kan Odell Beckham Jr. være tilknyttet et hold"
