Category,Headline,SubHeading
Tennis,Rune har allerede lært af ny træner: - Jeg er bare superglad,Holger Rune tog revanche mod Miomir Kecmanovic
Tennis,Derfor er Boris Becker alene som træner i Runes boks,Lars Christensen er ikke med Holger Rune-lejren i Basel. Det vil heller ikke være tilfældet i Paris i næste uge
Tennis,"- Jeg vil hellere have, at folk taler lort om mig, end at de slet ikke taler om mig","Den danske tennisspiller lytter kun til positiv eller negativ kritik, når det kommer fra teamet, der er omkring ham"
Tennis,Rune får mulighed for lynhurtig revanche,"Rune har 300 ATP-point, han skal forsvare fra sidste års finaleplads i Basel"
Tennis,"- Vi dødelige aner ikke, hvor hårdt det er","Holger Rune har endelig fået én ind i sit team, der selv har erfaring med at vinde Grand Slams som spiller"
Tennis,"Rune kan gnide sig i hænderne, når han ser Beckers resultater","Boris Becker nåede at træne Novak Djokovic i tre sæsoner, hvor serberen var noget nær umulig at slå"
Tennis,Rune-lejren forklarer tennisikons rolle,Boris Becker kommer til at være manden i Runes boks sæsonen ud. 
Tennis,Ansættelse af legende kommer bag på ekspert,"Peter Bastiansen er ikke sikker på, om den tyske legende Boris Becker kan bidrage med det, som Rune har allermest brug for i øjeblikket"
Tennis,Rune får tysk legende som fast træner ,Han bliver en del af trænerteamet i næste uge til ATP 500-turneringen i Basel. 
Tennis,"Nu er Rune i sin første store krise, siger ekspert",Holger Rune har vundet én kamp i løbet af det seneste kvartal. 
Tennis,Rune er selvsikker trods ny fiasko,Holger Rune tabte sin første kamp ved Stockholm Open onsdag aften. Danskeren er alligevel optimistisk
Tennis,Rune i ny fiasko – taber første kamp i Stockholm ,Holger Rune har nu tabt 10 af sine 11 seneste kampe. 
Tennis,"Rune åbner titelforsvar mod spiller, der minder om Djokovic","Holger Rune sad over i første runde i turneringen, da han er topseedet. Men onsdag skal han i aktion"
Tennis,Becker-samarbejde har fået Rune til at mærke en virkelig stor forskel,Holger Rune har indtil videre nydt godt af samarbejdet med den tidligere tennisstjerne Boris Becker
Tennis,"Ifølge tysk medie bliver legende ""super-coach"" for Rune","Aneke Rune kan hverken af- eller bekræfte, om der er indgået et samarbejde med Boris Becker"
Tennis,Holger Rune og Aneke taler ud om reprimande,"Aneke Rune forsøgte at få gang i sin søn, da det så allersværest ud"
Tennis,Rune falder ned på verdensranglisten,Efter en serie af dårlige resultater er Holger Rune røget ned på sjettepladsen på ranglisten
Tennis,"Runes store drøm svinder hen – men det er faktisk et mirakel, at håbet stadig lever","Slutspurten mod sæsonfinalerne starter nu, og Holger Rune har kniven for struben"
Tennis,Blev rasende på fotograf på afgørende tidspunkt – kort efter var finalen tabt,Rublev endte med at tabe kampen efter tiebreak
Tennis,"- Det må føles rart for Holger, siger Aneke Rune om nyt samarbejde",Der er en rigtig god kemi mellem Holger Rune og Boris Becker. 
Tennis,Boris Becker hjælper Holger Rune med træningen,I Lars Christensens fravær har Boris Becker hjulpet Holger Rune på træningsbanen
Tennis,Rune får lovende lodtrækning i titelforsvar,Den 20-årige dansker har fået en overkommelig lodtrækning til Stockholm Open
Tennis,Dommer nægtede – så gav modstander smuk gestus,De to amerikanske talenter Sebastian Korda og Ben Shelton pressede hinanden til det yderste i en Masters-kvartfinale i Shanghai
Tennis,ATP-turnering i Tel Aviv aflyses,"En tennisturnering, der skulle have fundet sted i Tel Aviv i november, er blevet aflyst af sikkerhedshensyn"
Tennis,I bagklogskabens lys ville Rune-lejren gerne have gjort én ting om,Holger Rune er i arbejdstøjet og gør sig klar til de kommende uger
Tennis,Alcaraz i sjældent tidligt exit,"Carlos Alcaraz tabte ottendedelsfinale til Grigor Dimitrov i Shanghai, hvor de fleste favoritter er ude"
Tennis,Nadal gør comeback i stor turnering,"Spanieren har været ude siden januar, hvor han kom til skade i netop Australian Open"
Tennis,Billeder af ugidelig stjerne vækker opsigt,Benoit Paire gjorde ikke meget for at vinde tenniskampen mod Pedro Martinez
Tennis,Swiatek stopper US Open-mesteren,"Efter 16 sejre i træk fik Coco Gauff bank af Iga Swiatek i China Open, hvor interessen er begrænset"
Tennis,Midt i stor ydmygelse fik Rune kontant besked af sin mor,Tennisekspert Michael Tauson har ikke mange positive ting at sige om Holger Runes nederlag til ranglistens nummer 122
Tennis,Rasende Rune ydmyget i stor turnering,"Holger Rune var chanceløs i mødet med verdens nummer 122, amerikanske Brandon Nakashima"
Tennis,"Rune har noget, som modstander ikke har, mener ekspert",Holger Rune har været inde i en bølgedal
Tennis,Murray rasende efter intens duel,Den tidligere verdensetter blev nødt til at få afløb for sin vrede
Tennis,Australier undskylder efter diskvalifikation,Han vil blandt andet invitere kampens dommer på kaffe
Tennis,Sinner vinder og bryder forbandelse,"Jannik Sinner fik for første gang i karrieren skovlen under Daniil Medvedev, da han vandt China Open"
Tennis,Her dummer spiller sig på historisk dårligt tidspunkt,Australieren kunne ikke styre sin vrede efter en misset matchbold
Tennis,Sinner slår Alcaraz og rykker forbi Holger Rune,Jannik Sinner slog Carlos Alcaraz i China Open og rykker forbi Holger Rune på verdensranglisten
Tennis,Australian Open reagerer efter spillernes kritik,For at minimere sene aftenkampe tilføjer Australian Open i 2024 en ekstra dag til kampprogrammet
Tennis,Stjerne klarede sig igennem disse scener,En af verdens bedste tennisspillere kæmpede med maveonde mandag aften. 
Tennis,"Ekspert er klar i mælet: - Det er spillere, Rune skal kunne slå",Efter en hård lodtrækning i Beijing har lodtrækningsguderne været gode ved Holger Rune
Tennis,Rune skal i aktion igen – og får overkommelig modstander,"Holger Rune kan møde Carlos Alcaraz i finalen, hvis de begge når dertil"
Tennis,"Det hele er ikke så sort efter Rune-nederlag, mener ekspert","Holger Rune spiller en turnering mere i Kina i form af Shanghai Masters, før et stort pointforsvar i Europa venter"
Tennis,Rune lider sit første nederlag i Kina,Holger Rune fandt aldrig rytmen og er derfor ude af turneringen
Tennis,"- Vi så den gamle Rune, siger ekspert",Den unge tennisspiller har bokset med rygproblemer og nedadgående spil det sidste stykke tid
Tennis,Stjerne raser: - Er du blind?,"Verdens nummer tre argumenterede for, at det var boldpigens skyld"
Tennis,Rune med god udmelding efter forløsende sejr,Efter en svær periode tog Holger Rune sin første sejr i mere end to måneder
Tennis,Tauson trækker sig fra stor turnering,Clara Tauson har fortsat problemer med ryggen og har trukket sig fra kvalifikationen til WTA 1000-turneringen i Beijing
Tennis,Rune vinder første kamp i over to måneder,Holger Rune er videre til anden runde efter en sejr i to sæt
Tennis,"- Jeg glæder mig til at spille noget af mit bedste tennis, siger Rune",Den 20-årige dansker har aldrig tabt i Kina
Tennis,Rune klar efter pause: - Jeg har spillet turneringer med smerter,Efter noget tids pause føler Holger Rune sig igen klar til kamp
Tennis,Tauson-lejr melder ud efter skade,Den danske damesingle havde tabt første sæt
Tennis,Tauson i tårer – tvunget til at trække sig,Den 20-årige tennisspiller kæmpede med smerter i ryggen undervejs i kampen
Tennis,Ekspert gyser: - Det er en jo en vanvittig lodtrækning,"Holger Rune skal finde tilbage til sit gamle jeg, hvis hans stime på syv nederlag i træk skal brydes ved China Open. "
Tennis,Rune får svær lodtrækning i Kina,Turneringen i Beijing er en opvarmning til den store Masters-turnering i Shanghai i næste uge. 
Tennis,Her indleder Wozniacki den nye sæson,I forberedelserne til grand slam-turneringen Australian Open stiller Caroline Wozniacki til start i Auckland
Tennis,"- Jeg har den gladeste unge mand på banen, siger Runes mor","Holger Rune er landet i Kina og kan træne igennem i yderpositioner, fortæller Aneke Rune før China Open"
Tennis,"Hylder Tauson: - Det er tennis på højt, højt niveau",Tauson fulgte op på sit kollaps i sidste uge med en flot sejr mod en højere rangeret russer
Tennis,Tauson-opvisning i første kamp efter kollaps,Clara Tauson storspillede i andet sæt og er videre til anden runde i Ningbo
Tennis,"- Jeg er starstruck, indrømmer Rune","Holger Rune har tidligere fortalt, at Roger Federer er et stort idol"
Tennis,Godt nyt for Tauson efter uhyggelige billeder,"Clara Tauson har fået en restitutionsplan fra WTA's lægestab, som lige nu forløbet planmæssigt"
Tennis,Wozniacki afviser citater om dopingdømt stjerne,Simona Halep er blevet idømt en fire år lang karantæne. 
Tennis,Tauson er i bedring: - Hun overvåges af læger,"Clara Tauson kollapsede i tredje sæt, men er nu i bedring"
Tennis,Ubehagelige scener – Tauson går i jorden og køres fra banen,Clara Tauson fik det dårligt midt under en kamp i Kina og blev kørt væk efter flere minutters behandling. 
Tennis,Stjerne gør som Rune og trækker sig,Team Europe stiller til start ved Laver Cup uden en eneste top-fem-spiller
Tennis,Som 18-årig tordnede hun ind på den store scene – men hvor står Tauson nu?,Clara Tauson kæmper i øjeblikket for at genfinde sit tårnhøje niveau. 
Tennis,Topspiller tvunget til afbud efter absurd uheld på hotel,French Open-semifinalisten fik sig en ubehagelig på hotelværelset. 
Tennis,Rune-lejren melder ud efter scanning,"Aneke Rune deler godt nyt om sin søn, Holger Rune"
Tennis,Stjerners afbud er godt nyt for Rune,Holger Rune har selv peget på ATP Finals som et af sæsonens største mål
Tennis,"- Jeg kæmpede til det sidste, siger Tauson","Danskeren var suveræn i første sæt, men så blev det tæt i andet"
Tennis,Tauson videre i Kina efter gyser af en tiebreak,Clara Tauson har stadig ikke tabt til tjekkiske Linda Fruhvirtová
Tennis,Holger Rune melder afbud til Laver Cup,Holger Rune har meldt afbud til Laver Cup og er blevet afløst af spanieren Alejandro Davidovich Fokina
Tennis,Skuffende nederlag blev den store øjenåbner for Holger Rune,Davis Cup-opgøret mod brasilianske Thiago Monteiro var det syvende i træk uden sejr for Holger Rune
Tennis,Helt gal med Runes ryg – vil ikke tage flere piller ,"Smertedæmpende medicin har ikke kunnet hjælpe Holger Rune, der ikke kunne spille Davis Cup for Danmark lørdag"
Tennis,Danmark taber til Brasilien i Davis Cup,"Johannes Ingildsen og Christian Sigsgaard tabte, og dermed fører Brasilien med 3-0 i Davis Cup mod Danmark"
Tennis,Ingen Rune i doublen – tvivlsom til mulig single,"Holger Rune bliver ikke en del af den danske double, der skal forsøge at bringe spændingen tilbage i holdkampen mod Brasilien"
Tennis,Rune har målet for resten af sæsonen på plads – både på og uden for banen,Holger Rune har sat sig et mål for den resterende del af sæsonen
Tennis,Danmark under kæmpe pres efter Rune-skuffelse,"Holger Rune tabte fredag sin syvende kamp i træk, og Danmark er bagud 0-2 mod Brasilien i Davis Cup-dyst"
Tennis,"Efter hård periode: - Nu spiller jeg for noget, der er større end mig selv",Holger Rune glæder sig til at spille for Danmark
Tennis,Brasilien frygter en Rune i topform,"Det bliver forhåbentligt ikke til en herlig omgang brasiliansk tennissamba i Hillerød fredag og lørdag, hvor Danmark møder Brasilien i en vigtig kamp"
Tennis,Danmark nærmer sig toppen hurtigere end ventet,"Danmarks Davis Cup-hold er blot en sejr fra at dyste mod verdens bedste, hvis Brasilien besejres i weekenden"
Tennis,"Bekymrende billede tegner sig om Tausons trænersituation, mener ekspert",Danskeren har stoppet samarbejdet med sin træner Carlos Martinez
Tennis,Rune vil have ny person tilknyttet sit team,20-årige Holger Rune begynder så småt at få styr på sit team. 
Tennis,Rune har fået styr på fysikken ,Danskeren har haft det svært på tennisbanen siden Wimbledon
Tennis,Træner forlader Tauson,Samarbejdet ophæves efter fire måneder
Tennis,"- Umuligt at komme tilbage, siger ekspert om dopingdømte Halep",Den dobbelte Grand Slam-vinder står til fire års karantæne fra tennissporten efter brud på dopingregler
Tennis,Halep nægter at acceptere dopingdom,Simona Halep vil have Den Internationale Sportsdomstol til at omstøde dopingdom
Tennis,Halep får fire års karantæne,Tennisstjernen Simona Halep er idømt fire års karantæne for dopingforseelser
Tennis,Holger Rune sætter ord på trænersituation,"Holger Rune er glad for, at Lars Christensen fortsætter som hans træner"
Tennis,"- Det er vanvittigt, siger ekspert om Djokovic-triumf",Serberen er nu én Grand Slam-sejr fra at blive den mest vindende nogensinde
Tennis,Holger Rune har fået styr på trænersituationen,Lars Christensen kommer igen til at være enetræner for Holger Rune
Tennis,Djokovic afslører: Har tænkt på karrierestop,"Der er stadig mere benzin tilbage i tanken for Novak Djokovic, der har sikret sin 24. Grand Slam-titel.
"
Tennis,Djokovic tangerer rekord med sin 24. Grand Slam-titel,"Novak Djokovic vinder US Open-finalen over Daniil Medvedev i tre sæt og er nu oppe på 24 Grand Slam-titler.
"
Tennis,Kæmpe triumf for amerikansk teenager,"Den 19-årige Coco Gauff tabte første sæt klart, men slog alligevel Aryna Sabalenka i US Open-finalen"
Tennis,Djokovic er klar til US Open-finalen,"Det er tiende gang, at Novak Djokovic spiller sig i US Open-finalen. "
Tennis,Sabalenka møder 19-årig amerikaner i US Open-finalen,"Sabalenka jublede for tidligt og Gauff måtte finde sig i 50 minutters afbrydelse, da de hver især spillede sig i US Open-finalen"
Tennis,Stjerne advarer: - En spiller kommer til at dø,"Tennisstjernen Daniil Medvedev håber, at der bliver lavet flere tiltag mod varmen, inden der sker noget slemt"
Tennis,Alcaraz klar til stor semifinale,Usædvanligt uspektakulære Carlos Alcaraz spillede sig i US Open-semifinalen med en sejr over Alexander Zverev
Tennis,Wimbledon-mester ude af US Open,Madison Keys slog Wimbledon-mesteren Marketa Vondrousova i kvartfinalen af US Open og skal nu møde Sabalenka
Tennis,Tjekke spiller sig i semifinale mod Wozniacki-bøddel,"Karolina Muchova uddelte ""æg"" mod Sorana Cirstea og er dermed i semifinalen mod Coco Gauff"
Tennis,Djokovic skriver historie efter ny sejr ,Den 36-årige serber skulle kun bruge tre sæt til at ekspedere Taylor Fritz ud af turneringen
Tennis,Zverev videre ved US Open efter stort drama,I en underholdende og sen natteforestilling i US Open vandt Alexander Zverev en femsætter over Jannik Sinner
Tennis,Ny verdensetter i kvartfinalen ved US Open,"Kvindernes nye verdensetter, Aryna Sabalenka, var for svær for Daria Kasatkina i ottendedelsfinalen i US Open"
Tennis,Tidligere finalist smider tredjeseedet landsmand ud,"Madison Keys fik overraskende let spil og tabte kun fire partier mod tredjeseedede Jessica Pegula.
"
Tennis,"- Wozniacki kan sagtens komme i top-10, vurderer ekspert","Caroline Wozniacki blev sent søndag aften slået ud af US Open, da hun tabte til Coco Gauff"
Tennis,Verdensetteren detroniseret ,Iga Swiatek tabte sin US Open-ottendedelsfinale til Jelena Ostapenko og mister status som verdens nummer et
Tennis,"Her blev kampen tabt, forklarer Wozniacki",Wozniacki var en anelse utilfreds med sin førsteserv mod Coco Gauff
Tennis,Wozniacki sender klar besked efter US Open-exit,33-årige Wozniacki har tænkt sig at tage hjem fra US Open og komme i sit livs form
Tennis,Modstander hylder Wozniacki: - Hun er fantastisk,"Caroline Wozniacki kæmpede sig tilbage mod Coco Gauff, men tabte US Open-ottendedelsfinale i tre sæt.
"
Tennis,Wozniackis US Open-eventyr slutter efter drama,"Caroline Wozniacki fik bragt kampen i fjerde runde i tre sæt, men formåede ikke at avancere"
Tennis,"Wozniacki står overfor sin største udfordring, vurderer ekspert","Der venter Wozniacki hård modstand i verdens nummer seks, Coco Gauff. Men Peter Bastiansen vurderer det stadig som en 50/50-kamp. "
Tennis,Topspiller roser Wozniacki: - Fantastisk,"Russeren Aryna Sabalenka er imponeret over, at Caroline Wozniacki så hurtigt har vist højt niveau i US Open"
Tennis,For første gang skal Wozniacki forholde sig til uvant situation,Wozniacki skal møde en af USA's mest populære sportsudøvere
Tennis,Wozniacki blev forelagt utrolig bedrift og kunne ikke skjule smilet,"Wozniacki bliver lidt stolt, når hun reflekterer over sin karriere"
Tennis,Vigtig del af Wozniackis spil imponerer ekspert,Den 33-årige dansker har ikke vist tegn på fysisk svaghed ved US Open
Tennis,Tæt på gentagelse af legendarisk kamp,Jannik Sinner er med sin sejr i US Open et skridt tættere på gentagelse af historisk opgør mod Carlos Alcaraz
Tennis,"- Jeg havde ærlig talt aldrig troet på det, siger fænomen om Wozniacki-møde",19-årige Gauff husker tydeligt Wozniacki fra sin barndom
Tennis,Brite sender mesteren Alcaraz på overarbejde i US Open,"Carlos Alcaraz afgav sit første sæt ved grand slam-turneringen i New York, da han besejrede Daniel Evans"
Tennis,"- Jeg troede ikke på det, siger Wozniackis mand","Wozniackis mand, David Lee, elsker hvert et minut af US Open-eventyret"
Tennis,Stjernetræner melder ud efter Rune-brud,Holger Runes tidligere træner Patrick Mouratoglou reagerer på det sociale medie Instagram på bruddet med Rune
Tennis,Ung gut fik oplevelse for livet: - Han har gjort et godt stykke arbejde for Caroline,Caroline Wozniackis hittingpartner fik en stor oplevelse på Arhur Ashe Stadium
Tennis,Djokovic overvinder svær start og fuldender comeback,Med hiv og sving spillede Djokovic sig i ottendedelsfinalen ved US Open
Tennis,Wozniacki blev overrasket: - Det kunne jeg slet ikke huske,"Caroline Wozniacki er overrasket over, hvor stort et comeback hun leverede mod Jennifer Brady"
Tennis,Wozniacki fortsætter – videre efter stort comeback,Danskeren er nu klar til fjerde runde i US Open
Tennis,Wozniacki møder amerikansk stjerne,"Caroline Wozniacki skal i US Opens ottendedelsfinale møde verdens nummer seks, Coco Gauff, der slog belgier"
Tennis,"- Det er en drøm, siger Wozniacki",Caroline Wozniacki viste storspil i tredje runde af Grand Slam-turneringen
Tennis,"- Jeg ved, at jeg har det her niveau",33-årige Caroline Wozniacki står i tredje runde ved US Open
Tennis,Stjerne brød sammen i interview: - Det er hårdt at sige farvel,John Isner er indehaver af flere tennisrekorder
Tennis,"T-shirts og kasketter fyldte for Mouratoglou – et omvandrende cirkus, siger ekspert ","Eksperten finder det naturligt, at Rune nu går tilbage til Lars Christensen. "
Tennis,Amerikansk stjerne afbryder Wozniackis interview,Sidste års US Open-semifinalist Frances Tiafoe stødte ind i Caroline Wozniacki
Tennis,Alcaraz stormer videre ved US Open,Kun i tredje sæt formåede sydafrikaneren Lloyd Harris at give storfavoritten sved på panden
Tennis,Wozniacki bliver på den største scene ,Caroline Wozniacki møder amerikaneren Jennifer Brady på Arthur Ashe Stadium fredag aften dansk tid
Tennis,Rune-lejr forklarer beslutning om at stoppe med succestræner,Patrick Mouratoglou har tidligere trænet Serena Williams. 
Tennis,Rune stopper samarbejde med stjernetræner,"Nu skal Rune finde ud af, hvem der fremover skal være hans træner. "
Tennis,Tauson er uafklaret om trænersituation,"Clara Tauson udelukker ikke at fortsætte samarbejde med Holger Runes træner, Lars Christensen, efter exit"
Tennis,"- Det var forfærdeligt, siger Tauson",Den danske tennisspiller røg ud af US Open i anden runde
Tennis,Frustreret Tauson ude af US Open,Danskeren kunne slet ikke få sit spil til at fungere i torsdagens kamp
Tennis,"- Vi må jo se, hvad de kommer med, siger Tauson om tilskuere",Clara Tauson er ikke nervøs for at få tilskuerne på nakken
Tennis,Tauson jubler over dansk besøg,Den unge tennisspiller er klar til anden runde i Grand Slam-turneringen US Open
Tennis,"Kvitova mærkede ikke, at Wozniacki har været væk","Petra Kvitova, der følte sig flad, roste Caroline Wozniacki i store vendinger efter US Open-nederlag"
Tennis,"Wozniacki var forvandlet, siger ekspert",Caroline Wozniacki er videre til tredje runde af US Open efter en 2-0-sejr over Petra Kvitova
Tennis,Wozniacki har overgået sine egne forventninger,Caroline Wozniacki spillede sig tidligt torsdag morgen videre til tredje runde af US Open
Tennis,Wozniacki med enorm præstation – sender topspiller ud,33-årige Wozniacki fik verdens største tennisarena til at gynge
Tennis,"Ét svar fra Rune bekymrer international journalist – men det viser også, hvad han har brug for",Holger Rune står foran nogle svære beslutninger
Tennis,Tager hatten af for Wozniacki,I anden runde af US Open skal Caroline Wozniacki møde Petra Kvitova
Tennis,Publikums handling fik spiller til at bryde sammen,"Den rutinerede tysker erkender, at hun var langsom. Alligevel finder hun publikums opførsel helt utilstedelig"
Tennis,- Bane 17 lugter som Snoop Doggs dagligstue,Både Alexander Zverev og Maria Sakkari har oplevet en særpræget lugt på bane 17 ved US Open
Tennis,Rune skal træffe afgørende beslutning – ekspert er ikke i tvivl,"Holger Rune vil have mere stabilitet omkring sig, og det kræver, at der kommer styr på trænersituationen"
Tennis,Wozniacki løfter sløret for spøjs anekdote fra omklædningsrummet,"De to veninder stod og snakkede, mens ingen af dem anede, hvad der ventede dem i anden runde"
Tennis,"Tausons træner kom med et råd, der blev kampafgørende","Lars Christensen, der normalt har trænet Holger Rune, hjælper Clara Tauson ved US Open"
Tennis,Modstander blev sur på Tauson: - Jeg havde nok også protesteret,Clara Tauson forstår godt sin modstanders frustrationer. 
Tennis,Tauson om afgørende moment: - Fik én over nakken,Clara Tauson er klar til anden runde ved US Open
Tennis,Wozniacki møder Kvitova på verdens største tennisarena,"Caroline Wozniacki møder Petra Kvitova på Arthur Ashe Stadium natten til torsdag dansk tid.
"
Tennis,Tauson videre i US Open trods problemer,Den 20-årige dansker fik behandling i slutningen af første sæt – men overvandt problemerne
Tennis,Speciel kamp venter: - Det er altid svært,"Clara Tauson er den tredje dansker, der skal i aktion ved US Open"
Tennis,Wozniacki har kontaktet Rune efter nedtur,"Caroline Wozniacki er sikker på, at Holger Rune rejser sig efter det overraskende exit"
Tennis,"- Jeg bliver stadigvæk nummer et i verden, siger Rune efter chokexit","Holger Rune erkender, at han er inde i en svær periode lige nu, men han ser fremad"
Tennis,Magtdemonstration af Djokovic,"Novak Djokovic uddelte æg i første sæt mod Alexandre Müller, som ikke havde en chance mod serberen"
Tennis,"Det går bedre og bedre, siger Wozniacki","Caroline Wozniacki er svært tilfreds med, at hun er videre til anden runde i US Open"
Tennis,"- Det er specielt for os at være her, siger Wozniacki","Caroline Wozniacki spillede sig natten til tirsdag videre til anden runde af US Open.
"
Tennis,Runes modstander var også overrasket,Roberto Carballes Baena havde aldrig vundet over en top-10-spiller inden sejren over Holger Rune
Tennis,Wozniacki storspiller i Grand Slam-comeback,Caroline Wozniacki skal i aktion igen på onsdag
Tennis,"- Jeg spillede noget af min værste tennis, siger Rune",Den danske tennisstjerne var uigenkendelig mod Roberto Carballes Baena
Tennis,Én formulering fik journalist til at undre sig – og Wozniacki til at tænke sig om,"Wozniacki ved stadig ikke, om hendes comeback skal vare ét, to eller tre år"
Tennis,"- Jeg har aldrig set Rune på den måde, siger ekspert",Den 20-årige dansker nåede ikke videre fra første runde i US Open
Tennis,Rune i kæmpe US Open-skuffelse,Den danske tennisstjerne må vinke farvel til den store Grand Slam-turnering efter første runde
Tennis,Rune øjner stor fordel i svær optakt,Holger Rune har ikke fået meget kamptræning den seneste måned
Tennis,"- Det er kæmpestort, siger ekspert om historisk US Open for Danmark",Tennisekspert Peter Bastiansen vurderer danskernes chancer længere nede i artiklen
Tennis,Ingen grund til bekymring – Rune melder sig fit for fight,Rune går for første gang i karrieren ind til en Grand Slam som nummer fire i verden
Tennis,Wozniacki støtter Rune: - Det er lidt overraskende,Caroline Wozniacki forstår til fulde Holger Runes frustrationer. 
Tennis,"- Det er de samme to, som altid giver mig de dårligste baner, siger Rune","Holger Rune kalder det underligt, at han skal spille på en af de absolut mindste baner ved US Open"
Tennis,Wozniackis US Open-modstander er på plads,Caroline Wozniacki har fået en overkommelig modstander i US Opens første runde
Tennis,Tauson melder sig klar efter madforgiftning,Clara Tauson glæder sig også over at være tilbage på hardcourt-underlaget
Tennis,Tauson indkalder Runes træner til US Open,"Carlos Martinez er ikke med i New York, da han ikke kunne rejse med af personlige årsager"
Tennis,"Rune gevaldigt overset ved US Open: - De tager jo pis på ham, siger ekspert",Holger Rune er blevet gevaldigt nedprioriteret ved US Opens første runde
Tennis,Wozniacki henvendte sig til superstjerne inden comeback,"Wozniacki har søgt råd hos Serena Williams, der vandt utrolige 23 Grand Slam-titler, inden hun stoppede karrieren. "
Tennis,"- Jeg står helt sikkert et andet sted nu, siger Wozniacki",Caroline Wozniacki får sit Grand Slam-comeback natten til tirsdag dansk tid
Tennis,24-årig stopper karrieren efter dopingdom,Mikael Ymer har valgt at indstille sin tenniskarriere efter en dom for brud på dopingregler
Tennis,Her er danskernes modstandere i US Open,"Caroline Wozniacki fik en god lodtrækning til US Open og skal starte mod en spiller fra kvalifikationen.
"
Tennis,Rekordholder stopper karrieren,"John Isner, der har rekorden for flest serveesser og historiens længste kamp, stopper sin karriere"
